{
  "agent_card_ref": {
    "content_hash": "04919af421b4fc241de19586bd4da0a1efd191e4f47298ee78d03623e30698d4",
    "path": ".agentlas/agent-card.json",
    "slug": "agentlas-meta-agent"
  },
  "aliases": [
    "hephaestus",
    "agentlas-core-engine",
    "agentlas-meta-agent"
  ],
  "anti_triggers": [
    {
      "locale": "ko",
      "text": "법률 계약서를 검토하고 소송 전략을 작성해줘"
    },
    {
      "locale": "ko",
      "text": "인스타그램 게시물을 바로 업로드해줘"
    },
    {
      "locale": "en",
      "text": "generate a standalone marketing image"
    },
    {
      "locale": "en",
      "text": "run live stock trading or portfolio rebalancing"
    }
  ],
  "approval_requirements": [
    "Ask before public publishing, production deployment, paid API spend, destructive file actions, or permission widening."
  ],
  "approval_scope": {
    "grant": "per_call",
    "ttl_seconds": null
  },
  "benchmark_fixtures": null,
  "canonical_id": "local/hephaestus-meta-agent",
  "capabilities": [
    "create_single_agents",
    "build_agent_teams",
    "package_existing_agents",
    "build_agents_from_sessions",
    "normalize_session_sources",
    "compile_session_ir",
    "repair_agent_repos",
    "generate_routing_cards",
    "verify_agent_packages",
    "publish_cloud_agents",
    "sync_runtime_adapters",
    "manage_memory_tickets",
    "coordinate_ontology_runtime"
  ],
  "card_version": "2.0.1",
  "cloud_delegation_policy": "ask",
  "cost_hints": {
    "model_calls": "medium",
    "paid_api": false
  },
  "data_access": {
    "exports": [],
    "reads": [
      "project_memory",
      "agent_package_files",
      "routing_cards"
    ],
    "writes": [
      "project_files",
      "agent_package_contracts"
    ]
  },
  "description": "Portable four-agent Agentlas meta-agent team for creating, repairing, packaging, validating, and compiling session-derived Agentlas agents and multi-agent teams across Codex, Claude Code, Gemini, Antigravity, Cursor, terminal, and AGENTS.md runtimes.",
  "domains": [
    "software",
    "devops",
    "research"
  ],
  "entrypoints": {
    "agent": "AGENTS.md",
    "canonical_command": "/hep-build",
    "terminal": "bin/hephaestus hep-build"
  },
  "id": "local/hephaestus-meta-agent",
  "locale_coverage": {
    "partial": [],
    "primary": "en",
    "ready": [
      "ko",
      "en"
    ]
  },
  "memory_behavior": {
    "exports_to_cloud": false,
    "reads": "project",
    "writes": "project"
  },
  "name": "Hephaestus Agentlas Meta-Agent",
  "name_ko": "헤파이스토스 Agentlas 메타 에이전트",
  "optional_inputs": [
    {
      "description": "Existing agent, team, or plugin folder to repair or package.",
      "name": "agent_folder",
      "type": "path"
    },
    {
      "description": "Desired public command slug for newly generated packages.",
      "name": "global_command",
      "type": "string"
    },
    {
      "description": "Target runtime adapter set such as Codex, Claude Code, Gemini, Antigravity, Cursor, terminal, or AGENTS.md.",
      "name": "runtime_targets",
      "type": "array"
    }
  ],
  "required_inputs": [],
  "required_plugins": [],
  "revision": 2,
  "risk_profile": {
    "capabilities_at_risk": [
      "file_write",
      "cloud_call",
      "publish"
    ],
    "tier": "medium"
  },
  "routing_status": "searchable",
  "routing_status_reason": "Searchable metadata is complete; routing-ready has not been established.",
  "schemaVersion": "routing-card/2.0",
  "source": {
    "kind": "local_path",
    "package_hash": "sha256:5e39f294f7b0059f03fc5d7b7a12dc1ce056aa4a9111710929fe3308fec43f73",
    "package_version": "0.7.32",
    "ref": null
  },
  "summary": "Build, repair, package, validate, and publish Agentlas-compatible agents and teams across major agent runtimes.",
  "summary_ko": "Agentlas 호환 에이전트와 팀을 만들고, 고치고, 패키징하고, 검증하고, 공개/비공개 업로드까지 처리합니다.",
  "supported_runtimes": [
    "claude-code",
    "codex",
    "gemini-cli",
    "antigravity",
    "cursor",
    "terminal",
    "agents-md",
    "agentlas-desktop",
    "agentlas-web"
  ],
  "trigger_examples": [
    {
      "locale": "ko",
      "text": "새 리서치 에이전트 만들어줘"
    },
    {
      "locale": "ko",
      "text": "이 로컬 에이전트를 Agentlas 구조로 패키징해줘"
    },
    {
      "locale": "ko",
      "text": "멀티 에이전트 팀을 오케스트레이터와 QA 게이트까지 포함해서 만들어줘"
    },
    {
      "locale": "ko",
      "text": "routing-card가 깨진 에이전트 저장소를 업로드 가능하게 고쳐줘"
    },
    {
      "locale": "en",
      "text": "create a self-evolving research agent"
    },
    {
      "locale": "en",
      "text": "package this existing Claude agent into Agentlas architecture"
    },
    {
      "locale": "en",
      "text": "repair an existing agent repo to match the Agentlas contracts"
    },
    {
      "locale": "en",
      "text": "publish this Agentlas package to the Hub after validation"
    }
  ],
  "type": "team",
  "updated_at": "2026-06-25T00:00:00Z"
}
